{
  "ATTACKS": {
    "ember1": {"name":"Fire Bolt","desc":"One fire bolt","kind":"shot","n":1,"spd":380,"mult":1,"cd":1.1},
    "ember2": {"name":"Twin Bolts","desc":"Two fire bolts","kind":"shot","n":2,"spread":0.12,"spd":380,"mult":0.9,"cd":1.1},
    "emberFan": {"name":"Ember Fan","desc":"Three bolts in a fan","kind":"shot","n":3,"spread":0.15,"spd":400,"mult":0.85,"cd":1.1},
    "flamethrower": {"name":"Flamethrower","desc":"A short stream of flame","kind":"stream","n":6,"gap":0.05,"spread":0.18,"spd":330,"mult":0.42,"life":0.5,"cd":1.3,"r":6},
    "emberBurst": {"name":"Burst Bolts","desc":"Three bolts that explode","kind":"shot","n":3,"spread":0.15,"spd":400,"mult":0.8,"cd":1.15,"r":6,"explode":42},
    "foxfire": {"name":"Foxfire","desc":"Three homing flames","kind":"shot","n":3,"spread":0.5,"spd":300,"mult":0.8,"cd":1.2,"r":6,"homing":3,"life":2},
    "solarLance": {"name":"Solar Lance","desc":"A fast beam that pierces everything","kind":"shot","n":1,"spd":900,"mult":2.2,"cd":1.4,"r":7,"pierce":8,"life":0.9},
    "magmaSlam": {"name":"Magma Slam","desc":"Charges in and erupts","kind":"dash","sp":420,"range":140,"mult":1,"cd":1.6,"end":"fire"},
    "meteor": {"name":"Meteor","desc":"Lobs a fireball that bursts","kind":"lob","n":1,"mult":1.6,"rad":70,"cd":1.8},
    "eruption": {"name":"Eruption","desc":"Three meteors at once","kind":"lob","n":3,"mult":1.2,"rad":65,"cd":2},
    "spore1": {"name":"Spore","desc":"One slowing spore","kind":"shot","n":1,"spd":260,"mult":0.9,"cd":1.3,"r":6,"slow":1.2},
    "spore2": {"name":"Twin Spores","desc":"Two slowing spores","kind":"shot","n":2,"spread":0.2,"spd":260,"mult":0.85,"cd":1.3,"r":6,"slow":1.2},
    "sporeFan": {"name":"Spore Fan","desc":"Three spores, longer slow","kind":"shot","n":3,"spread":0.2,"spd":270,"mult":0.8,"cd":1.3,"r":6,"slow":1.8},
    "sporeMortar": {"name":"Spore Mortar","desc":"Lobs a pod that leaves a cloud","kind":"lob","n":1,"mult":0.9,"rad":60,"cd":1.7,"cloud":true},
    "thornRing": {"name":"Thorn Ring","desc":"Eight thorns in every direction","kind":"ring","n":8,"spd":300,"mult":0.6,"cd":1.5},
    "seedHoming": {"name":"Seeker Seeds","desc":"Three seeds that curve to foes","kind":"shot","n":3,"spread":0.6,"spd":260,"mult":0.75,"cd":1.3,"homing":3,"life":2},
    "hornCharge": {"name":"Horn Charge","desc":"Rams enemies and knocks them back","kind":"dash","sp":480,"range":170,"mult":1.2,"cd":1.4,"knock":24},
    "hornQuake": {"name":"Horn Quake","desc":"Rams and sends a shockwave","kind":"dash","sp":480,"range":170,"mult":1.3,"cd":1.5,"knock":24,"end":"shock"},
    "sporeStream": {"name":"Spore Stream","desc":"A rapid stream of slowing spores","kind":"stream","n":7,"gap":0.06,"spread":0.12,"spd":300,"mult":0.35,"life":0.8,"cd":1.3,"slow":1.2},
    "bubble1": {"name":"Bubble","desc":"One bubble","kind":"shot","n":1,"spd":280,"mult":0.8,"cd":1.2,"r":6},
    "bubblePierce": {"name":"Pierce Bubble","desc":"A bubble that passes through a foe","kind":"shot","n":1,"spd":300,"mult":0.9,"cd":1.2,"r":6,"pierce":1},
    "bubbleBounce": {"name":"Bounce Bubbles","desc":"Three bubbles that bounce off walls","kind":"shot","n":3,"spread":0.15,"spd":300,"mult":0.7,"cd":1.2,"r":6,"bounce":2,"life":2},
    "geyser": {"name":"Geyser","desc":"Water erupts under the target","kind":"strike","mult":1.5,"rad":55,"delay":0.5,"cd":1.6},
    "tidalWave": {"name":"Tidal Wave","desc":"A wide wave that rolls through foes","kind":"shot","n":1,"spd":240,"mult":1.4,"cd":1.6,"r":14,"pierce":6,"life":1.4},
    "clawPinch": {"name":"Claw Pinch","desc":"Scuttles in and pinches hard","kind":"dash","sp":380,"range":110,"mult":1.4,"cd":1.3,"knock":10},
    "clawCrush": {"name":"Claw Crush","desc":"Pinches and splashes a ring of bubbles","kind":"dash","sp":400,"range":120,"mult":1.5,"cd":1.4,"end":"ring"},
    "whirlpool": {"name":"Whirlpool","desc":"A swirling pool that pulls enemies in","kind":"field","rad":80,"dur":2.5,"mult":0.6,"pull":60,"cd":2.2},
    "pulse2": {"name":"Twin Pulse","desc":"Two sonic pulses","kind":"shot","n":2,"spread":0.08,"spd":420,"mult":0.6,"cd":1,"r":4},
    "pulse3": {"name":"Triple Pulse","desc":"Three sonic pulses","kind":"shot","n":3,"spread":0.08,"spd":420,"mult":0.6,"cd":1,"r":4},
    "pulse4": {"name":"Piercing Pulse","desc":"Four pulses that pierce","kind":"shot","n":4,"spread":0.08,"spd":440,"mult":0.6,"cd":1,"r":4,"pierce":1},
    "pulseHoming": {"name":"Seeking Pulse","desc":"Four pulses that seek foes","kind":"shot","n":4,"spread":0.3,"spd":400,"mult":0.6,"cd":1,"r":4,"homing":2.5,"life":1.8},
    "sonicRing": {"name":"Sonic Ring","desc":"A ring of ten pulses","kind":"ring","n":10,"spd":380,"mult":0.5,"cd":1.3},
    "chainShock": {"name":"Chain Shock","desc":"A bolt that jumps between foes","kind":"chain","jumps":3,"mult":1.1,"cd":1.3},
    "screech": {"name":"Screech","desc":"A cone of fast sound","kind":"shot","n":7,"spread":0.08,"spd":520,"mult":0.4,"cd":1.2,"r":4,"life":0.6},
    "dive": {"name":"Dive Strike","desc":"Dives at a foe","kind":"dash","sp":560,"range":190,"mult":1,"cd":1.3},
    "diveFast": {"name":"Swift Dive","desc":"Faster dives that hit twice as hard","kind":"dash","sp":640,"range":200,"mult":2,"cd":1},
    "diveRing": {"name":"Gust Dive","desc":"Dives end in a ring of wind","kind":"dash","sp":640,"range":210,"mult":2,"cd":1,"end":"ring"},
    "featherFan": {"name":"Feather Fan","desc":"Five feathers in a wide fan","kind":"shot","n":5,"spread":0.2,"spd":460,"mult":0.55,"cd":1.1,"r":4},
    "tornado": {"name":"Tornado","desc":"A twister that travels and shreds","kind":"field","rad":50,"dur":2,"mult":0.7,"move":160,"cd":2},
    "lightning": {"name":"Lightning","desc":"Strikes a foe and arcs to others","kind":"chain","jumps":4,"mult":1.3,"cd":1.3},
    "shard3": {"name":"Shard Spray","desc":"Three shards","kind":"shot","n":3,"spread":0.12,"spd":340,"mult":0.5,"cd":1.4,"r":4},
    "shard5": {"name":"Wide Spray","desc":"Five shards","kind":"shot","n":5,"spread":0.12,"spd":340,"mult":0.5,"cd":1.4,"r":4},
    "shard5p": {"name":"Piercing Spray","desc":"Five piercing shards","kind":"shot","n":5,"spread":0.12,"spd":360,"mult":0.5,"cd":1.4,"r":4,"pierce":1},
    "shardSplit": {"name":"Split Shard","desc":"Shards that split in three","kind":"shot","n":2,"spread":0.2,"spd":360,"mult":0.7,"cd":1.4,"r":5,"split":true},
    "orbit": {"name":"Orbiting Shards","desc":"Six shards circle, then launch","kind":"orbit","n":6,"mult":0.6,"cd":1.8},
    "prismBeam": {"name":"Prism Beam","desc":"A long piercing beam of light","kind":"shot","n":1,"spd":900,"mult":2,"cd":1.4,"r":6,"pierce":6,"life":0.9},
    "slam": {"name":"Stone Slam","desc":"Slams a foe","kind":"dash","sp":420,"range":130,"mult":0.9,"cd":1.6,"knock":20},
    "slamShock": {"name":"Shock Slam","desc":"Slams and sends a shockwave","kind":"dash","sp":420,"range":130,"mult":1,"cd":1.6,"knock":30,"end":"shock"},
    "quakeSlam": {"name":"Quake Slam","desc":"Slams, shocks and draws aggro","kind":"dash","sp":440,"range":140,"mult":1.1,"cd":1.6,"knock":30,"end":"quake"},
    "rollBoulder": {"name":"Boulder Roll","desc":"Rolls a huge piercing boulder","kind":"shot","n":1,"spd":230,"mult":1.6,"cd":1.7,"r":13,"pierce":5,"life":1.6},
    "boulderLob": {"name":"Boulder Toss","desc":"Throws a boulder that cracks the ground","kind":"lob","n":1,"mult":1.7,"rad":70,"cd":1.9},
    "runeBolt": {"name":"Rune Bolt","desc":"Two heavy rune bolts","kind":"shot","n":2,"spread":0.15,"spd":360,"mult":1,"cd":1.4,"r":7},
    "runeHoming": {"name":"Rune Seekers","desc":"Four runes that seek foes","kind":"shot","n":4,"spread":0.5,"spd":320,"mult":0.8,"cd":1.5,"r":6,"homing":3,"life":2}
  },
  "ABILITIES": {
    "flameRing": {"name":"Flame Ring","desc":"Blasts 12 fire bolts in a ring","cd":8},
    "meteorShower": {"name":"Meteor Shower","desc":"Six meteors rain on nearby foes","cd":9},
    "infernoNova": {"name":"Inferno Nova","desc":"Burns every enemy nearby and blasts a 24-bolt ring","cd":10},
    "sporeField": {"name":"Spore Field","desc":"A cloud that slows and damages for 4s","cd":8},
    "healBloom": {"name":"Healing Bloom","desc":"Heals you 25 and your companions 30%","cd":10},
    "rotCloud": {"name":"Rot Cloud","desc":"A huge spore cloud that spores everything inside","cd":10},
    "tideShield": {"name":"Tide Shield","desc":"You take no damage for 3s and heal 20","cd":8},
    "tidalSurge": {"name":"Tidal Surge","desc":"Sixteen piercing bubbles roll forward","cd":9},
    "deluge": {"name":"Deluge","desc":"Shields you, heals everyone and soaks all nearby foes","cd":11},
    "echoPing": {"name":"Echo Ping","desc":"Stuns nearby enemies for 1.6s","cd":8},
    "sonicBoom": {"name":"Sonic Boom","desc":"Stuns for 2.5s and deals heavy damage","cd":10},
    "stormCall": {"name":"Storm Call","desc":"Charges every nearby foe with static, then thunder strikes","cd":11},
    "gustDash": {"name":"Gust Dash","desc":"Dashes through foes for heavy damage","cd":8},
    "cyclone": {"name":"Cyclone","desc":"A cyclone that pulls enemies in and shreds them","cd":10},
    "skyStrike": {"name":"Sky Strike","desc":"Three lightning strikes on the strongest foes","cd":10},
    "prismWard": {"name":"Prism Ward","desc":"Turns enemy bullets near you back on them for 3s","cd":8},
    "shardStorm": {"name":"Shard Storm","desc":"24 piercing shards in every direction","cd":9},
    "mirrorField": {"name":"Mirror Field","desc":"Reflects bullets for 5s and makes foes brittle","cd":11},
    "taunt": {"name":"Taunt","desc":"Enemies attack it for 4s; it takes half damage","cd":8},
    "quake": {"name":"Quake","desc":"Stuns everything within reach and staggers them","cd":10},
    "fortress": {"name":"Fortress","desc":"Taunts, and the whole party takes half damage for 5s","cd":11}
  },
  "TYPE_ABIL": {
    "ember": "flameRing",
    "fungal": "sporeField",
    "tide": "tideShield",
    "echo": "echoPing",
    "gale": "gustDash",
    "crystal": "prismWard",
    "warden": "taunt"
  },
  "ELEM": {
    "burn": {"name":"Burning","col":"#ff7a3d"},